{
  "controls": {
    "_comment_live_preview": "true = live JSON; false = saved animation (other JSON controls then have no effect).",
    "live_preview": true,
    "_comment_layout": "Choose \"grid\", \"rings\" or \"spiral\". Keep the quotes.",
    "layout": "spiral",
    "_comment_wave_mode": "Choose \"plane\", \"radial\" or \"swirl\". Keep the quotes.",
    "wave_mode": "swirl",
    "_comment_strength": "Range 0 to 1; default 1.0. Overall animated effect strength; zero gives the neutral cloner.",
    "strength": 0.5699999872595072,
    "_comment_spacing_cm": "Range 50 to 500; default 160.0. Grid spacing or spacing between rings.",
    "spacing_cm": 378.88999153114855,
    "_comment_amplitude_cm": "Range 0 to 1500; default 220.0. Wave height.",
    "amplitude_cm": 600.0,
    "_comment_wavelength_cm": "Range 100 to 10000; default 1600.0. Distance between wave crests. Try 1800; near/below clone spacing the pattern can look irregular.",
    "wavelength_cm": 1800.0,
    "_comment_speed_hz": "Range -2 to 2; default 0.25. Cycles per second, not percent. Try 0.5 (one cycle every 2 seconds); negative reverses travel; 0 freezes the wave.",
    "speed_hz": 1.9999999552965164,
    "_comment_phase_degrees": "Range -360 to 360; default 0.0. Wave phase offset.",
    "phase_degrees": 359.99999195337296,
    "_comment_direction_degrees": "Range -180 to 180; default 25.0. Direction in degrees; affects plane waves only.",
    "direction_degrees": 85.53999808803201,
    "_comment_base_scale": "Range 0.1 to 3; default 0.7. Neutral clone scale multiplier.",
    "base_scale": 0.7799999825656414,
    "_comment_scale_wave": "Range 0 to 0.9; default 0.45. Wave-driven scale modulation relative to base scale.",
    "scale_wave": 0.8,
    "_comment_rotation_degrees": "Range 0 to 180; default 35.0. Wave-driven clone tilt.",
    "rotation_degrees": 60.0,
    "_comment_spin_degrees_per_second": "Range -360 to 360; default 45.0. Continuous clone spin.",
    "spin_degrees_per_second": 45.0,
    "_comment_noise_cm": "Range 0 to 500; default 25.0. Deterministic per-clone bobbing amplitude.",
    "noise_cm": 499.9999888241291,
    "_comment_noise_speed_hz": "Range 0 to 2; default 0.5. Noise oscillation speed.",
    "noise_speed_hz": 0.12999999709427357,
    "_comment_falloff_radius_cm": "Range 100 to 20000; default 4500.0. Effect fades to zero at this radius. Try 12000 so most clones move; a small radius leaves outer clones still.",
    "falloff_radius_cm": 13501.129698226228,
    "_comment_color_cycle_hz": "Range 0 to 2; default 0.375. Prototype steps per second among three shared material configurations.",
    "color_cycle_hz": 1.50999996624887
  },
  "schema_version": 1,
  "topology": {
    "rows": 32,
    "columns": 32,
    "seed": 7
  },
  "_help": {
    "edit": "Edit the values after each _comment_ hint and SAVE, or use the Motion Graphics Controls panel. Hints are ignored by motion evaluation.",
    "syntax": "Keep commas between entries and quotes around text. Use decimal numbers like 0.5, not 500. No // comments or literal line breaks inside strings.",
    "topology": "Fixed 32 x 32 for stable IDs; changing topology requires a separate rebuild.",
    "live_preview": "false removes the temporary runtime layer and resumes the saved animation.",
    "layout": "grid, rings, spiral",
    "wave_mode": "plane, radial, swirl",
    "bake": "Saved clip is 8 seconds at 60 time codes/s, sampled every 2 frames. JSON changes are live only until explicitly baked.",
    "fields": {
      "strength": "Overall animated effect strength; zero gives the neutral cloner.",
      "spacing_cm": "Grid spacing or spacing between rings.",
      "amplitude_cm": "Wave height.",
      "wavelength_cm": "Distance between wave crests. Try 1800; near/below clone spacing the pattern can look irregular.",
      "speed_hz": "Cycles per second, not percent. Try 0.5 (one cycle every 2 seconds); negative reverses travel; 0 freezes the wave.",
      "phase_degrees": "Wave phase offset.",
      "direction_degrees": "Direction in degrees; affects plane waves only.",
      "base_scale": "Neutral clone scale multiplier.",
      "scale_wave": "Wave-driven scale modulation relative to base scale.",
      "rotation_degrees": "Wave-driven clone tilt.",
      "spin_degrees_per_second": "Continuous clone spin.",
      "noise_cm": "Deterministic per-clone bobbing amplitude.",
      "noise_speed_hz": "Noise oscillation speed.",
      "falloff_radius_cm": "Effect fades to zero at this radius. Try 12000 so most clones move; a small radius leaves outer clones still.",
      "color_cycle_hz": "Prototype steps per second among three shared material configurations."
    }
  },
  "$schema": "./motion_graphics.schema.json"
}
